Tweets,ISI,sentiment,tokenization,remove_stopword,normalisasi_tweet,tweet
imdinus sepertinya  kalau untuk  keseluruhan mata kuliah mah akhir maret cuman mata kuliah kesehatan mental mingdep xe2 x80 xa6 cqqpwymq1w,imdinus sepertinya kalau untuk keseluruhan mata kuliah mah akhir maret cuman mata kuliah kesehatan mental mingdep cqqpwymq ,imdinus sepertinya kalau untuk keseluruhan mata kuliah mah akhir maret cuman mata kuliah kesehatan mental mingdep cqqpwymq ,"['imdinus', 'sepertinya', 'kalau', 'untuk', 'keseluruhan', 'mata', 'kuliah', 'mah', 'akhir', 'maret', 'cuman', 'mata', 'kuliah', 'kesehatan', 'mental', 'mingdep', 'cqqpwymq', '']","['imdinus', 'mata', 'kuliah', 'mah', 'maret', 'cuman', 'mata', 'kuliah', 'kesehatan', 'mental', 'mingdep', 'cqqpwymq', '']","['imdinus', 'mata', 'kuliah', 'mah', 'maret', 'hanya', 'mata', 'kuliah', 'kesehatan', 'mental', 'mingdep', 'cqqpwymq', '']",imdinus mata kuliah mah maret hanya mata kuliah kesehatan mental mingdep cqqpwymq
imkyulii dih najis mental,imkyulii dih najis mental,imkyulii dih najis mental,"['imkyulii', 'dih', 'najis', 'mental']","['imkyulii', 'dih', 'najis', 'mental']","['imkyulii', 'dih', 'najis', 'mental']",imkyulii dih najis mental
immagoodgirllll benar  siapin mental dulu,immagoodgirllll benar siapin mental dulu,immagoodgirllll benar siapin mental dulu,"['immagoodgirllll', 'benar', 'siapin', 'mental', 'dulu']","['immagoodgirllll', 'siapin', 'mental']","['immagoodgirllll', 'siapin', 'mental']",immagoodgirllll siapin mental
imposingkeymas1 infotwitwor nanti  makin banyak pernikahan dibawah umur karena  pada siap mental jadinya cerai xe2 x80 xa6 c4vqkcchhn,imposingkeymas infotwitwor nanti makin banyak pernikahan dibawah umur karena pada siap mental jadinya cerai vqkcchhn,imposingkeymas infotwitwor nanti makin banyak pernikahan dibawah umur karena pada siap mental jadinya cerai vqkcchhn,"['imposingkeymas', 'infotwitwor', 'nanti', 'makin', 'banyak', 'pernikahan', 'dibawah', 'umur', 'karena', 'pada', 'siap', 'mental', 'jadinya', 'cerai', 'vqkcchhn']","['imposingkeymas', 'infotwitwor', 'pernikahan', 'dibawah', 'umur', 'mental', 'cerai', 'vqkcchhn']","['imposingkeymas', 'infotwitwor', 'pernikahan', 'dibawah', 'umur', 'mental', 'cerai', 'vqkcchhn']",imposingkeymas infotwitwor pernikahan dibawah umur mental cerai vqkcchhn
imyourgiaa huhuhu mengumpulkan mental dulu,imyourgiaa huhuhu mengumpulkan mental dulu,imyourgiaa huhuhu mengumpulkan mental dulu,"['imyourgiaa', 'huhuhu', 'mengumpulkan', 'mental', 'dulu']","['imyourgiaa', 'huhuhu', 'mengumpulkan', 'mental']","['imyourgiaa', 'huhuhu', 'mengumpulkan', 'mental']",imyourgiaa huhuhu mengumpulkan mental
imyours2123 iyaa tidak apa-apa semangat jaga kesehatan mental kamuu ya happy selalu,imyours iyaa tidak apa apa semangat jaga kesehatan mental kamuu happy selalu,imyours iyaa tidak apa apa semangat jaga kesehatan mental kamuu happy selalu,"['imyours', 'iyaa', 'tidak', 'apa', 'apa', 'semangat', 'jaga', 'kesehatan', 'mental', 'kamuu', 'happy', 'selalu']","['imyours', 'iyaa', 'semangat', 'jaga', 'kesehatan', 'mental', 'kamuu', 'happy']","['imyours', 'iyaa', 'semangat', 'jaga', 'kesehatan', 'mental', 'kamuu', 'happy']",imyours iyaa semangat jaga kesehatan mental kamuu happy
inaivatco urwande retno wiranti siapkan mental okta endingnya membagongkan,inaivatco urwande retno wiranti siapkan mental okta endingnya membagongkan,inaivatco urwande retno wiranti siapkan mental okta endingnya membagongkan,"['inaivatco', 'urwande', 'retno', 'wiranti', 'siapkan', 'mental', 'okta', 'endingnya', 'membagongkan']","['inaivatco', 'urwande', 'retno', 'wiranti', 'siapkan', 'mental', 'okta', 'endingnya', 'membagongkan']","['inaivatco', 'urwande', 'retno', 'wiranti', 'siapkan', 'mental', 'okta', 'endingnya', 'membagongkan']",inaivatco urwande retno wiranti siapkan mental okta endingnya membagongkan
inana9194 iya saya kalau  hayoung tidak mungkin kuat deh serius bakal nonjok kitae ditempat terus  nangis terus  kena mental terus  gila,inana iya saya kalau hayoung tidak mungkin kuat deh serius bakal nonjok kitae ditempat terus nangis terus kena mental terus gila,inana iya saya kalau hayoung tidak mungkin kuat deh serius bakal nonjok kitae ditempat terus nangis terus kena mental terus gila,"['inana', 'iya', 'saya', 'kalau', 'hayoung', 'tidak', 'mungkin', 'kuat', 'deh', 'serius', 'bakal', 'nonjok', 'kitae', 'ditempat', 'terus', 'nangis', 'terus', 'kena', 'mental', 'terus', 'gila']","['inana', 'iya', 'hayoung', 'kuat', 'deh', 'serius', 'nonjok', 'kitae', 'ditempat', 'nangis', 'kena', 'mental', 'gila']","['inana', 'iya', 'hayoung', 'kuat', 'deh', 'serius', 'nonjok', 'kitae', 'ditempat', 'nangis', 'kena', 'mental', 'gila']",inana iya hayoung kuat deh serius nonjok kitae ditempat nangis kena mental gila
indomyfess nyiapin mental saja  takut sesak nafas liat 7bujang dengan  rambut gondrong nya xf0 x9f x99 x83,indomyfess nyiapin mental saja takut sesak nafas liat bujang dengan rambut gondrong nya ,indomyfess nyiapin mental saja takut sesak nafas liat bujang dengan rambut gondrong nya ,"['indomyfess', 'nyiapin', 'mental', 'saja', 'takut', 'sesak', 'nafas', 'liat', 'bujang', 'dengan', 'rambut', 'gondrong', 'nya', '']","['indomyfess', 'nyiapin', 'mental', 'takut', 'sesak', 'nafas', 'liat', 'bujang', 'rambut', 'gondrong', 'nya', '']","['indomyfess', 'nyiapin', 'mental', 'takut', 'sesak', 'nafas', 'liat', 'bujang', 'rambut', 'gondrong', 'nya', '']",indomyfess nyiapin mental takut sesak nafas liat bujang rambut gondrong nya
indomyfess nyiapin mental saja  sender kek nya tetap mental yupi bagaimana  seeehhhh xf0 x9f x98 xad,indomyfess nyiapin mental saja sender kek nya tetap mental yupi bagaimana seeehhhh xad,indomyfess nyiapin mental saja sender kek nya tetap mental yupi bagaimana seeehhhh xad,"['indomyfess', 'nyiapin', 'mental', 'saja', 'sender', 'kek', 'nya', 'tetap', 'mental', 'yupi', 'bagaimana', 'seeehhhh', 'xad']","['indomyfess', 'nyiapin', 'mental', 'sender', 'kek', 'nya', 'mental', 'yupi', 'seeehhhh', 'xad']","['indomyfess', 'nyiapin', 'mental', 'sender', 'kek', 'nya', 'mental', 'yupi', 'seeehhhh', 'xad']",indomyfess nyiapin mental sender kek nya mental yupi seeehhhh xad
indomyfess nyiapin mental saja  sudah  paaling benar ,indomyfess nyiapin mental saja sudah paaling benar ,indomyfess nyiapin mental saja sudah paaling benar ,"['indomyfess', 'nyiapin', 'mental', 'saja', 'sudah', 'paaling', 'benar', '']","['indomyfess', 'nyiapin', 'mental', 'paaling', '']","['indomyfess', 'nyiapin', 'mental', 'paaling', '']",indomyfess nyiapin mental paaling
indomyfess nyiapin mental biar gila parah sih xf0 x9f x98 xad,indomyfess nyiapin mental biar gila parah sih xad,indomyfess nyiapin mental biar gila parah sih xad,"['indomyfess', 'nyiapin', 'mental', 'biar', 'gila', 'parah', 'sih', 'xad']","['indomyfess', 'nyiapin', 'mental', 'biar', 'gila', 'parah', 'sih', 'xad']","['indomyfess', 'nyiapin', 'mental', 'biar', 'gila', 'parah', 'sih', 'xad']",indomyfess nyiapin mental biar gila parah sih xad
indomyfess nyiapin mental untuk  teriak xf0 x9f x98 xad xf0 x9f x98 xad takut kena marah orangtua  xf0 x9f x98 xad xf0 x9f x98 xad xf0 x9f x99 x8f xf0 x9f x8f xbb xf0 x9f x99 x8f xf0 x9f x8f xbb xf0 x9f x99 x8f xf0 x9f x8f xbb plisss senang  sekali  nonton konser xf0 x9f x98 xad xf0 x9f x98 xad,indomyfess nyiapin mental untuk teriak xad xad takut kena marah orangtua xad xad xbb xbb xbb plisss senang sekali nonton konser xad xad,indomyfess nyiapin mental untuk teriak xad xad takut kena marah orangtua xad xad xbb xbb xbb plisss senang sekali nonton konser xad xad,"['indomyfess', 'nyiapin', 'mental', 'untuk', 'teriak', 'xad', 'xad', 'takut', 'kena', 'marah', 'orangtua', 'xad', 'xad', 'xbb', 'xbb', 'xbb', 'plisss', 'senang', 'sekali', 'nonton', 'konser', 'xad', 'xad']","['indomyfess', 'nyiapin', 'mental', 'teriak', 'xad', 'xad', 'takut', 'kena', 'marah', 'orangtua', 'xad', 'xad', 'xbb', 'xbb', 'xbb', 'plisss', 'senang', 'nonton', 'konser', 'xad', 'xad']","['indomyfess', 'nyiapin', 'mental', 'teriak', 'xad', 'xad', 'takut', 'kena', 'marah', 'orangtua', 'xad', 'xad', 'xbb', 'xbb', 'xbb', 'plisss', 'senang', 'nonton', 'konser', 'xad', 'xad']",indomyfess nyiapin mental teriak xad xad takut kena marah orangtua xad xad xbb xbb xbb plisss senang nonton konser xad xad
indomyfess nyiapin mental untuk  liat encim sabarrr sabarrr xf0 x9f x98 xa3,indomyfess nyiapin mental untuk liat encim sabarrr sabarrr ,indomyfess nyiapin mental untuk liat encim sabarrr sabarrr ,"['indomyfess', 'nyiapin', 'mental', 'untuk', 'liat', 'encim', 'sabarrr', 'sabarrr', '']","['indomyfess', 'nyiapin', 'mental', 'liat', 'encim', 'sabarrr', 'sabarrr', '']","['indomyfess', 'nyiapin', 'mental', 'liat', 'encim', 'sabarrr', 'sabarrr', '']",indomyfess nyiapin mental liat encim sabarrr sabarrr
indomyfess nyiapin mental jantung biar tidak  mleyot xf0 x9f x98 xad xf0 x9f x98 xad,indomyfess nyiapin mental jantung biar tidak mleyot xad xad,indomyfess nyiapin mental jantung biar tidak mleyot xad xad,"['indomyfess', 'nyiapin', 'mental', 'jantung', 'biar', 'tidak', 'mleyot', 'xad', 'xad']","['indomyfess', 'nyiapin', 'mental', 'jantung', 'biar', 'mleyot', 'xad', 'xad']","['indomyfess', 'nyiapin', 'mental', 'jantung', 'biar', 'mleyot', 'xad', 'xad']",indomyfess nyiapin mental jantung biar mleyot xad xad
indomyfess nyiapin mental jantung sudah paling benar  xf0 x9f x98 x82 xf0 x9f x91 x8d,indomyfess nyiapin mental jantung sudah paling benar ,indomyfess nyiapin mental jantung sudah paling benar ,"['indomyfess', 'nyiapin', 'mental', 'jantung', 'sudah', 'paling', 'benar', '']","['indomyfess', 'nyiapin', 'mental', 'jantung', '']","['indomyfess', 'nyiapin', 'mental', 'jantung', '']",indomyfess nyiapin mental jantung
indomyfess nyiapin mental jiwa raga xf0 x9f x98 xad,indomyfess nyiapin mental jiwa raga xad,indomyfess nyiapin mental jiwa raga xad,"['indomyfess', 'nyiapin', 'mental', 'jiwa', 'raga', 'xad']","['indomyfess', 'nyiapin', 'mental', 'jiwa', 'raga', 'xad']","['indomyfess', 'nyiapin', 'mental', 'jiwa', 'raga', 'xad']",indomyfess nyiapin mental jiwa raga xad
indomyfess nyiapin mental liat jas merah sama rambut kunciran xf0 x9f x98 xad xf0 x9f xa4 x9a,indomyfess nyiapin mental liat jas merah sama rambut kunciran xad ,indomyfess nyiapin mental liat jas merah sama rambut kunciran xad ,"['indomyfess', 'nyiapin', 'mental', 'liat', 'jas', 'merah', 'sama', 'rambut', 'kunciran', 'xad', '']","['indomyfess', 'nyiapin', 'mental', 'liat', 'jas', 'merah', 'rambut', 'kunciran', 'xad', '']","['indomyfess', 'nyiapin', 'mental', 'liat', 'jas', 'merah', 'rambut', 'kunciran', 'xad', '']",indomyfess nyiapin mental liat jas merah rambut kunciran xad
indomyfess nyiapin mental liat story teman  titik titik nonton konser bangtan,indomyfess nyiapin mental liat story teman titik titik nonton konser bangtan,indomyfess nyiapin mental liat story teman titik titik nonton konser bangtan,"['indomyfess', 'nyiapin', 'mental', 'liat', 'story', 'teman', 'titik', 'titik', 'nonton', 'konser', 'bangtan']","['indomyfess', 'nyiapin', 'mental', 'liat', 'story', 'teman', 'titik', 'titik', 'nonton', 'konser', 'bangtan']","['indomyfess', 'nyiapin', 'mental', 'liat', 'story', 'teman', 'titik', 'titik', 'nonton', 'konser', 'bangtan']",indomyfess nyiapin mental liat story teman titik titik nonton konser bangtan
indomyfess nyiapin mental min takutnya syokkk liat abs xe2 x80 x9d suami xf0 x9f xa4 x97 xf0 x9f x98 xad,indomyfess nyiapin mental min takutnya syokkk liat abs suami xad,indomyfess nyiapin mental min takutnya syokkk liat abs suami xad,"['indomyfess', 'nyiapin', 'mental', 'min', 'takutnya', 'syokkk', 'liat', 'abs', 'suami', 'xad']","['indomyfess', 'nyiapin', 'mental', 'min', 'takutnya', 'syokkk', 'liat', 'abs', 'suami', 'xad']","['indomyfess', 'nyiapin', 'mental', 'min', 'takutnya', 'syokkk', 'liat', 'abs', 'suami', 'xad']",indomyfess nyiapin mental min takutnya syokkk liat abs suami xad
indomyfess nyiapin mental myy,indomyfess nyiapin mental myy,indomyfess nyiapin mental myy,"['indomyfess', 'nyiapin', 'mental', 'myy']","['indomyfess', 'nyiapin', 'mental', 'myy']","['indomyfess', 'nyiapin', 'mental', 'myy']",indomyfess nyiapin mental myy
indomyfess nyiapin mental sender wlkwksjahag sabar xf0 x9f x98 xad xf0 x9f x98 xad xf0 x9f x98 xad xf0 x9f x98 xad xf0 x9f x98 xad xf0 x9f x98 xad,indomyfess nyiapin mental sender wlkwksjahag sabar xad xad xad xad xad xad,indomyfess nyiapin mental sender wlkwksjahag sabar xad xad xad xad xad xad,"['indomyfess', 'nyiapin', 'mental', 'sender', 'wlkwksjahag', 'sabar', 'xad', 'xad', 'xad', 'xad', 'xad', 'xad']","['indomyfess', 'nyiapin', 'mental', 'sender', 'wlkwksjahag', 'sabar', 'xad', 'xad', 'xad', 'xad', 'xad', 'xad']","['indomyfess', 'nyiapin', 'mental', 'sender', 'wlkwksjahag', 'sabar', 'xad', 'xad', 'xad', 'xad', 'xad', 'xad']",indomyfess nyiapin mental sender wlkwksjahag sabar xad xad xad xad xad xad
iniixc cepuin nya kamu tidak mau keributan wah sayang sekali tontonan gratis kok dilewatkan arak sampai kena mental manusia magadir,iniixc cepuin nya kamu tidak mau keributan wah sayang sekali tontonan gratis kok dilewatkan arak sampai kena mental manusia magadir,iniixc cepuin nya kamu tidak mau keributan wah sayang sekali tontonan gratis kok dilewatkan arak sampai kena mental manusia magadir,"['iniixc', 'cepuin', 'nya', 'kamu', 'tidak', 'mau', 'keributan', 'wah', 'sayang', 'sekali', 'tontonan', 'gratis', 'kok', 'dilewatkan', 'arak', 'sampai', 'kena', 'mental', 'manusia', 'magadir']","['iniixc', 'cepuin', 'nya', 'keributan', 'sayang', 'tontonan', 'gratis', 'dilewatkan', 'arak', 'kena', 'mental', 'manusia', 'magadir']","['iniixc', 'cepuin', 'nya', 'keributan', 'sayang', 'tontonan', 'gratis', 'dilewatkan', 'arak', 'kena', 'mental', 'manusia', 'magadir']",iniixc cepuin nya keributan sayang tontonan gratis dilewatkan arak kena mental manusia magadir
iniixc iyaa mental sudah  guncang liat ketikan,iniixc iyaa mental sudah guncang liat ketikan,iniixc iyaa mental sudah guncang liat ketikan,"['iniixc', 'iyaa', 'mental', 'sudah', 'guncang', 'liat', 'ketikan']","['iniixc', 'iyaa', 'mental', 'guncang', 'liat', 'ketikan']","['iniixc', 'iyaa', 'mental', 'guncang', 'liat', 'ketikan']",iniixc iyaa mental guncang liat ketikan
iniixc kaga usah balas  mental sampah,iniixc kaga usah balas mental sampah,iniixc kaga usah balas mental sampah,"['iniixc', 'kaga', 'usah', 'balas', 'mental', 'sampah']","['iniixc', 'kaga', 'balas', 'mental', 'sampah']","['iniixc', 'kaga', 'balas', 'mental', 'sampah']",iniixc kaga balas mental sampah
iniixc kalau  kaya kemarin  saya mau siapin mental dulu ,iniixc kalau kaya kemarin saya mau siapin mental dulu ,iniixc kalau kaya kemarin saya mau siapin mental dulu ,"['iniixc', 'kalau', 'kaya', 'kemarin', 'saya', 'mau', 'siapin', 'mental', 'dulu', '']","['iniixc', 'kaya', 'kemarin', 'siapin', 'mental', '']","['iniixc', 'kaya', 'kemarin', 'siapin', 'mental', '']",iniixc kaya kemarin siapin mental
iniixc mental baja nih,iniixc mental baja nih,iniixc mental baja nih,"['iniixc', 'mental', 'baja', 'nih']","['iniixc', 'mental', 'baja', 'nih']","['iniixc', 'mental', 'baja', 'nih']",iniixc mental baja nih
iniixc mental mental yupi kak,iniixc mental mental yupi kak,iniixc mental mental yupi kak,"['iniixc', 'mental', 'mental', 'yupi', 'kak']","['iniixc', 'mental', 'mental', 'yupi', 'kak']","['iniixc', 'mental', 'mental', 'yupi', 'kak']",iniixc mental mental yupi kak
iniixc pernah sekali  kalau  sudah  berbagai cara mental sih bakal deketin satu satu sksd satu satu terbukti ampuh xf0 x9f x91 x8d,iniixc pernah sekali kalau sudah berbagai cara mental sih bakal deketin satu satu sksd satu satu terbukti ampuh ,iniixc pernah sekali kalau sudah berbagai cara mental sih bakal deketin satu satu sksd satu satu terbukti ampuh ,"['iniixc', 'pernah', 'sekali', 'kalau', 'sudah', 'berbagai', 'cara', 'mental', 'sih', 'bakal', 'deketin', 'satu', 'satu', 'sksd', 'satu', 'satu', 'terbukti', 'ampuh', '']","['iniixc', 'mental', 'sih', 'deketin', 'sksd', 'terbukti', 'ampuh', '']","['iniixc', 'mental', 'sih', 'deketin', 'sksd', 'terbukti', 'ampuh', '']",iniixc mental sih deketin sksd terbukti ampuh
iniixc sudah  kena mental,iniixc sudah kena mental,iniixc sudah kena mental,"['iniixc', 'sudah', 'kena', 'mental']","['iniixc', 'kena', 'mental']","['iniixc', 'kena', 'mental']",iniixc kena mental
iniixc sudah  mental baja,iniixc sudah mental baja,iniixc sudah mental baja,"['iniixc', 'sudah', 'mental', 'baja']","['iniixc', 'mental', 'baja']","['iniixc', 'mental', 'baja']",iniixc mental baja
inilabamanusia andalan saya  sudah  nongol mental sudah  stabil nampaknya xf0 x9f x98 x82 xf0 x9f xa4 xa3,inilabamanusia andalan saya sudah nongol mental sudah stabil nampaknya ,inilabamanusia andalan saya sudah nongol mental sudah stabil nampaknya ,"['inilabamanusia', 'andalan', 'saya', 'sudah', 'nongol', 'mental', 'sudah', 'stabil', 'nampaknya', '']","['inilabamanusia', 'andalan', 'nongol', 'mental', 'stabil', 'nampaknya', '']","['inilabamanusia', 'andalan', 'nongol', 'mental', 'stabil', 'nampaknya', '']",inilabamanusia andalan nongol mental stabil nampaknya
injangie kuatinn mental,injangie kuatinn mental,injangie kuatinn mental,"['injangie', 'kuatinn', 'mental']","['injangie', 'kuatinn', 'mental']","['injangie', 'kuatinn', 'mental']",injangie kuatinn mental
insandhaif1704 kangdede78 erickthohir buang xc2 xb2 duit negara saja  gaji orang jadi komisaris mental preman pak,insandhaif kangdede erickthohir buang duit negara saja gaji orang jadi komisaris mental preman pak,insandhaif kangdede erickthohir buang duit negara saja gaji orang jadi komisaris mental preman pak,"['insandhaif', 'kangdede', 'erickthohir', 'buang', 'duit', 'negara', 'saja', 'gaji', 'orang', 'jadi', 'komisaris', 'mental', 'preman', 'pak']","['insandhaif', 'kangdede', 'erickthohir', 'buang', 'duit', 'negara', 'gaji', 'orang', 'komisaris', 'mental', 'preman']","['insandhaif', 'kangdede', 'erickthohir', 'buang', 'duit', 'negara', 'gaji', 'orang', 'komisaris', 'mental', 'preman']",insandhaif kangdede erickthohir buang duit negara gaji orang komisaris mental preman
instruvmen gistfara latihan untuk  siapin mental kayaknya bakal yang budak cinta,instruvmen gistfara latihan untuk siapin mental kayaknya bakal yang budak cinta,instruvmen gistfara latihan untuk siapin mental kayaknya bakal yang budak cinta,"['instruvmen', 'gistfara', 'latihan', 'untuk', 'siapin', 'mental', 'kayaknya', 'bakal', 'yang', 'budak', 'cinta']","['instruvmen', 'gistfara', 'latihan', 'siapin', 'mental', 'kayaknya', 'budak', 'cinta']","['instruvmen', 'gistfara', 'latihan', 'siapin', 'mental', 'kayaknya', 'budak', 'cinta']",instruvmen gistfara latihan siapin mental kayaknya budak cinta
intakfess p1h members intak foto pose nya gini kak tenang persiapkan mental xf0 x9f x99 x8f,intakfess members intak foto pose nya gini kak tenang persiapkan mental ,intakfess members intak foto pose nya gini kak tenang persiapkan mental ,"['intakfess', 'members', 'intak', 'foto', 'pose', 'nya', 'gini', 'kak', 'tenang', 'persiapkan', 'mental', '']","['intakfess', 'members', 'intak', 'foto', 'pose', 'nya', 'gini', 'kak', 'tenang', 'persiapkan', 'mental', '']","['intakfess', 'members', 'intak', 'foto', 'pose', 'nya', 'gini', 'kak', 'tenang', 'persiapkan', 'mental', '']",intakfess members intak foto pose nya gini kak tenang persiapkan mental
intanazreni cederaa mental wehhh kalau macam ,intanazreni cederaa mental wehhh kalau macam ,intanazreni cederaa mental wehhh kalau macam ,"['intanazreni', 'cederaa', 'mental', 'wehhh', 'kalau', 'macam', '']","['intanazreni', 'cederaa', 'mental', 'wehhh', '']","['intanazreni', 'cederaa', 'mental', 'wehhh', '']",intanazreni cederaa mental wehhh
inter extra penting menang modal mental serie,inter extra penting menang modal mental serie,inter extra penting menang modal mental serie,"['inter', 'extra', 'penting', 'menang', 'modal', 'mental', 'serie']","['inter', 'extra', 'menang', 'modal', 'mental', 'serie']","['inter', 'extra', 'menang', 'modal', 'mental', 'serie']",inter extra menang modal mental serie
inter lolos sih seenggaknya nunjukkin mental bandel skuad seadaanya pasca ditinggal pemain binta xe2 x80 xa6 lbvv7vpcxk,inter lolos sih seenggaknya nunjukkin mental bandel skuad seadaanya pasca ditinggal pemain binta lbvv vpcxk,inter lolos sih seenggaknya nunjukkin mental bandel skuad seadaanya pasca ditinggal pemain binta lbvv vpcxk,"['inter', 'lolos', 'sih', 'seenggaknya', 'nunjukkin', 'mental', 'bandel', 'skuad', 'seadaanya', 'pasca', 'ditinggal', 'pemain', 'binta', 'lbvv', 'vpcxk']","['inter', 'lolos', 'sih', 'seenggaknya', 'nunjukkin', 'mental', 'bandel', 'skuad', 'seadaanya', 'pasca', 'ditinggal', 'pemain', 'binta', 'lbvv', 'vpcxk']","['inter', 'lolos', 'sih', 'seenggaknya', 'nunjukkin', 'mental', 'bandel', 'skuad', 'seadaanya', 'pasca', 'ditinggal', 'pemain', 'binta', 'lbvv', 'vpcxk']",inter lolos sih seenggaknya nunjukkin mental bandel skuad seadaanya pasca ditinggal pemain binta lbvv vpcxk
interclubindo menang anfield bekal berharga untuk  mental xf0 x9f x92 xaa,interclubindo menang anfield bekal berharga untuk mental xaa,interclubindo menang anfield bekal berharga untuk mental xaa,"['interclubindo', 'menang', 'anfield', 'bekal', 'berharga', 'untuk', 'mental', 'xaa']","['interclubindo', 'menang', 'anfield', 'bekal', 'berharga', 'mental', 'xaa']","['interclubindo', 'menang', 'anfield', 'bekal', 'berharga', 'mental', 'xaa']",interclubindo menang anfield bekal berharga mental xaa
interistalk yes memang kalah skor menang mental yuk fokus liga coppa xf0 x9f x98 x98 xf0 x9f x98 x98,interistalk yes memang kalah skor menang mental yuk fokus liga coppa ,interistalk yes memang kalah skor menang mental yuk fokus liga coppa ,"['interistalk', 'yes', 'memang', 'kalah', 'skor', 'menang', 'mental', 'yuk', 'fokus', 'liga', 'coppa', '']","['interistalk', 'yes', 'kalah', 'skor', 'menang', 'mental', 'yuk', 'fokus', 'liga', 'coppa', '']","['interistalk', 'yes', 'kalah', 'skor', 'menang', 'mental', 'yuk', 'fokus', 'liga', 'coppa', '']",interistalk yes kalah skor menang mental yuk fokus liga coppa
interistierick idextratime iyah tidak  lolos puas sama permainan mental pemain mulai pulih semenjak xe2 x80 xa6 pfsvtfhrqp,interistierick idextratime iyah tidak lolos puas sama permainan mental pemain mulai pulih semenjak pfsvtfhrqp,interistierick idextratime iyah tidak lolos puas sama permainan mental pemain mulai pulih semenjak pfsvtfhrqp,"['interistierick', 'idextratime', 'iyah', 'tidak', 'lolos', 'puas', 'sama', 'permainan', 'mental', 'pemain', 'mulai', 'pulih', 'semenjak', 'pfsvtfhrqp']","['interistierick', 'idextratime', 'iyah', 'lolos', 'puas', 'permainan', 'mental', 'pemain', 'pulih', 'semenjak', 'pfsvtfhrqp']","['interistierick', 'idextratime', 'iyah', 'lolos', 'puas', 'permainan', 'mental', 'pemain', 'pulih', 'semenjak', 'pfsvtfhrqp']",interistierick idextratime iyah lolos puas permainan mental pemain pulih semenjak pfsvtfhrqp
inveistor saya tanggal cuman tanya  untuk  siapin mental hahaha,inveistor saya tanggal cuman tanya untuk siapin mental hahaha,inveistor saya tanggal cuman tanya untuk siapin mental hahaha,"['inveistor', 'saya', 'tanggal', 'cuman', 'tanya', 'untuk', 'siapin', 'mental', 'hahaha']","['inveistor', 'tanggal', 'cuman', 'siapin', 'mental', 'hahaha']","['inveistor', 'tanggal', 'hanya', 'siapin', 'mental', 'hahaha']",inveistor tanggal hanya siapin mental hahaha
inyourl ove latihan mental ditinggal ayank sini xf0 x9f x98 x8e,inyourl ove latihan mental ditinggal ayank sini ,inyourl ove latihan mental ditinggal ayank sini ,"['inyourl', 'ove', 'latihan', 'mental', 'ditinggal', 'ayank', 'sini', '']","['inyourl', 'ove', 'latihan', 'mental', 'ditinggal', 'ayank', '']","['inyourl', 'ove', 'latihan', 'mental', 'ditinggal', 'ayank', '']",inyourl ove latihan mental ditinggal ayank
ipb menfess dewasa secara  usia bukan berarti sejalan sama dewasa secara  mental,ipb menfess dewasa secara usia bukan berarti sejalan sama dewasa secara mental,ipb menfess dewasa secara usia bukan berarti sejalan sama dewasa secara mental,"['ipb', 'menfess', 'dewasa', 'secara', 'usia', 'bukan', 'berarti', 'sejalan', 'sama', 'dewasa', 'secara', 'mental']","['ipb', 'menfess', 'dewasa', 'usia', 'sejalan', 'dewasa', 'mental']","['ipb', 'menfess', 'dewasa', 'usia', 'sejalan', 'dewasa', 'mental']",ipb menfess dewasa usia sejalan dewasa mental
iphonenyaandin mnc pictures lucunya sok iye terus  dia kena mental gara-gara skak mat gara-gara  kebdohanya xf0 x9f xa4 xa3,iphonenyaandin mnc pictures lucunya sok iye terus dia kena mental gara gara skak mat gara gara kebdohanya ,iphonenyaandin mnc pictures lucunya sok iye terus dia kena mental gara gara skak mat gara gara kebdohanya ,"['iphonenyaandin', 'mnc', 'pictures', 'lucunya', 'sok', 'iye', 'terus', 'dia', 'kena', 'mental', 'gara', 'gara', 'skak', 'mat', 'gara', 'gara', 'kebdohanya', '']","['iphonenyaandin', 'mnc', 'pictures', 'lucunya', 'sok', 'iye', 'kena', 'mental', 'gara', 'gara', 'skak', 'mat', 'gara', 'gara', 'kebdohanya', '']","['iphonenyaandin', 'mnc', 'pictures', 'lucunya', 'sok', 'iye', 'kena', 'mental', 'gara', 'gara', 'skak', 'mat', 'gara', 'gara', 'kebdohanya', '']",iphonenyaandin mnc pictures lucunya sok iye kena mental gara gara skak mat gara gara kebdohanya
iputuputras money merusak mental kesehatan kak xf0 x9f x99 x83,iputuputras money merusak mental kesehatan kak ,iputuputras money merusak mental kesehatan kak ,"['iputuputras', 'money', 'merusak', 'mental', 'kesehatan', 'kak', '']","['iputuputras', 'money', 'merusak', 'mental', 'kesehatan', 'kak', '']","['iputuputras', 'money', 'merusak', 'mental', 'kesehatan', 'kak', '']",iputuputras money merusak mental kesehatan kak
irvinvizan fisik mental tidak aman xf0 x9f x98 x94 xf0 x9f x98 xad,irvinvizan fisik mental tidak aman xad,irvinvizan fisik mental tidak aman xad,"['irvinvizan', 'fisik', 'mental', 'tidak', 'aman', 'xad']","['irvinvizan', 'fisik', 'mental', 'aman', 'xad']","['irvinvizan', 'fisik', 'mental', 'aman', 'xad']",irvinvizan fisik mental aman xad
