Tweets,ISI,sentiment,tokenization,remove_stopword,normalisasi_tweet,tweet
convomf jujur saya tahu  apa dimaksudkan orangtua menjatuhkan mental anaknya itu wha xe2 x80 xa6 r8leqjtc9d,convomf jujur saya tahu apa dimaksudkan orangtua menjatuhkan mental anaknya itu wha leqjtc ,convomf jujur saya tahu apa dimaksudkan orangtua menjatuhkan mental anaknya itu wha leqjtc ,"['convomf', 'jujur', 'saya', 'tahu', 'apa', 'dimaksudkan', 'orangtua', 'menjatuhkan', 'mental', 'anaknya', 'itu', 'wha', 'leqjtc', '']","['convomf', 'jujur', 'orangtua', 'menjatuhkan', 'mental', 'anaknya', 'wha', 'leqjtc', '']","['convomf', 'jujur', 'orangtua', 'menjatuhkan', 'mental', 'anaknya', 'wha', 'leqjtc', '']",convomf jujur orangtua menjatuhkan mental anaknya wha leqjtc
convomf orangtua  kamu tahu  kondisi fisik amp mental kamu sedang baik2 saja  serius ini jangan xe2 x80 xa6 lttl8n6b5a,convomf orangtua kamu tahu kondisi fisik amp mental kamu sedang baik saja serius ini jangan lttl ,convomf orangtua kamu tahu kondisi fisik amp mental kamu sedang baik saja serius ini jangan lttl ,"['convomf', 'orangtua', 'kamu', 'tahu', 'kondisi', 'fisik', 'amp', 'mental', 'kamu', 'sedang', 'baik', 'saja', 'serius', 'ini', 'jangan', 'lttl', '']","['convomf', 'orangtua', 'kondisi', 'fisik', 'amp', 'mental', 'serius', 'lttl', '']","['convomf', 'orangtua', 'kondisi', 'fisik', 'amp', 'mental', 'serius', 'lttl', '']",convomf orangtua kondisi fisik amp mental serius lttl
convomf mental saya baik tidak ada apaapa loh tidak punya masalah berat happy for life,convomf mental saya baik tidak ada apaapa loh tidak punya masalah berat happy for life,convomf mental saya baik tidak ada apaapa loh tidak punya masalah berat happy for life,"['convomf', 'mental', 'saya', 'baik', 'tidak', 'ada', 'apaapa', 'loh', 'tidak', 'punya', 'masalah', 'berat', 'happy', 'for', 'life']","['convomf', 'mental', 'ada', 'apaapa', 'loh', 'berat', 'happy', 'for', 'life']","['convomf', 'mental', 'ada', 'apaapa', 'loh', 'berat', 'happy', 'for', 'life']",convomf mental ada apaapa loh berat happy for life
convomf dia kena mental sender serius,convomf dia kena mental sender serius,convomf dia kena mental sender serius,"['convomf', 'dia', 'kena', 'mental', 'sender', 'serius']","['convomf', 'kena', 'mental', 'sender', 'serius']","['convomf', 'kena', 'mental', 'sender', 'serius']",convomf kena mental sender serius
convomf sender keren sangat  serius kena mental xf0 x9f xa4 xa9,convomf sender keren sangat serius kena mental ,convomf sender keren sangat serius kena mental ,"['convomf', 'sender', 'keren', 'sangat', 'serius', 'kena', 'mental', '']","['convomf', 'sender', 'keren', 'serius', 'kena', 'mental', '']","['convomf', 'sender', 'keren', 'serius', 'kena', 'mental', '']",convomf sender keren serius kena mental
convomf ngapain kena mental grgr orang merendah meninggi merendahkan orang xf0 x9f x98 x8c xf0 x9f x98 x8c blokir saja  sender teman  begitu  tahi  sangat ,convomf ngapain kena mental grgr orang merendah meninggi merendahkan orang blokir saja sender teman begitu tahi sangat ,convomf ngapain kena mental grgr orang merendah meninggi merendahkan orang blokir saja sender teman begitu tahi sangat ,"['convomf', 'ngapain', 'kena', 'mental', 'grgr', 'orang', 'merendah', 'meninggi', 'merendahkan', 'orang', 'blokir', 'saja', 'sender', 'teman', 'begitu', 'tahi', 'sangat', '']","['convomf', 'ngapain', 'kena', 'mental', 'grgr', 'orang', 'merendah', 'meninggi', 'merendahkan', 'orang', 'blokir', 'sender', 'teman', 'tahi', '']","['convomf', 'ngapain', 'kena', 'mental', 'grgr', 'orang', 'merendah', 'meninggi', 'merendahkan', 'orang', 'blokir', 'sender', 'teman', 'tahi', '']",convomf ngapain kena mental grgr orang merendah meninggi merendahkan orang blokir sender teman tahi
cygaraga jnnazira ayuazizz mental sudah  rosak selalu gaduh hahaha,cygaraga jnnazira ayuazizz mental sudah rosak selalu gaduh hahaha,cygaraga jnnazira ayuazizz mental sudah rosak selalu gaduh hahaha,"['cygaraga', 'jnnazira', 'ayuazizz', 'mental', 'sudah', 'rosak', 'selalu', 'gaduh', 'hahaha']","['cygaraga', 'jnnazira', 'ayuazizz', 'mental', 'rosak', 'gaduh', 'hahaha']","['cygaraga', 'jnnazira', 'ayuazizz', 'mental', 'rosak', 'gaduh', 'hahaha']",cygaraga jnnazira ayuazizz mental rosak gaduh hahaha
depressshot komen apa bingung semoga kakak sehat saja  fisik maupun mental xf0 x9f xa5 xb0,depressshot komen apa bingung semoga kakak sehat saja fisik maupun mental ,depressshot komen apa bingung semoga kakak sehat saja fisik maupun mental ,"['depressshot', 'komen', 'apa', 'bingung', 'semoga', 'kakak', 'sehat', 'saja', 'fisik', 'maupun', 'mental', '']","['depressshot', 'komen', 'bingung', 'semoga', 'kakak', 'sehat', 'fisik', 'mental', '']","['depressshot', 'komen', 'bingung', 'semoga', 'kakak', 'sehat', 'fisik', 'mental', '']",depressshot komen bingung semoga kakak sehat fisik mental
dilrabea kapok cess pernah terus  malah masuk baju saya  sumpah trauma kena mental saya  saat xf0 x9f x98 xad,dilrabea kapok cess pernah terus malah masuk baju saya sumpah trauma kena mental saya saat xad,dilrabea kapok cess pernah terus malah masuk baju saya sumpah trauma kena mental saya saat xad,"['dilrabea', 'kapok', 'cess', 'pernah', 'terus', 'malah', 'masuk', 'baju', 'saya', 'sumpah', 'trauma', 'kena', 'mental', 'saya', 'saat', 'xad']","['dilrabea', 'kapok', 'cess', 'masuk', 'baju', 'sumpah', 'trauma', 'kena', 'mental', 'xad']","['dilrabea', 'kapok', 'cess', 'masuk', 'baju', 'sumpah', 'trauma', 'kena', 'mental', 'xad']",dilrabea kapok cess masuk baju sumpah trauma kena mental xad
dribble9 dapettttt cuman mental grgr bingung sendiri,dribble dapettttt cuman mental grgr bingung sendiri,dribble dapettttt cuman mental grgr bingung sendiri,"['dribble', 'dapettttt', 'cuman', 'mental', 'grgr', 'bingung', 'sendiri']","['dribble', 'dapettttt', 'cuman', 'mental', 'grgr', 'bingung']","['dribble', 'dapettttt', 'hanya', 'mental', 'grgr', 'bingung']",dribble dapettttt hanya mental grgr bingung
dulc3b3a susah kalau saya anak siapkan manuskrip keadaan rushing sangat mengganggu mental xe2 x80 xa6 6zjjtx0kvm,dulc susah kalau saya anak siapkan manuskrip keadaan rushing sangat mengganggu mental zjjtx kvm,dulc susah kalau saya anak siapkan manuskrip keadaan rushing sangat mengganggu mental zjjtx kvm,"['dulc', 'susah', 'kalau', 'saya', 'anak', 'siapkan', 'manuskrip', 'keadaan', 'rushing', 'sangat', 'mengganggu', 'mental', 'zjjtx', 'kvm']","['dulc', 'susah', 'anak', 'siapkan', 'manuskrip', 'rushing', 'mengganggu', 'mental', 'zjjtx', 'kvm']","['dulc', 'susah', 'anak', 'siapkan', 'manuskrip', 'rushing', 'mengganggu', 'mental', 'zjjtx', 'kvm']",dulc susah anak siapkan manuskrip rushing mengganggu mental zjjtx kvm
ehara poetry aduh  ngeri sedep xf0 x9f x98 xad semoga selalu dilindungi selalu kuat mental tidak  dijahilin xf0 x9f xa4 xb2,ehara poetry aduh ngeri sedep xad semoga selalu dilindungi selalu kuat mental tidak dijahilin ,ehara poetry aduh ngeri sedep xad semoga selalu dilindungi selalu kuat mental tidak dijahilin ,"['ehara', 'poetry', 'aduh', 'ngeri', 'sedep', 'xad', 'semoga', 'selalu', 'dilindungi', 'selalu', 'kuat', 'mental', 'tidak', 'dijahilin', '']","['ehara', 'poetry', 'aduh', 'ngeri', 'sedep', 'xad', 'semoga', 'dilindungi', 'kuat', 'mental', 'dijahilin', '']","['ehara', 'poetry', 'aduh', 'ngeri', 'sedep', 'xad', 'semoga', 'dilindungi', 'kuat', 'mental', 'dijahilin', '']",ehara poetry aduh ngeri sedep xad semoga dilindungi kuat mental dijahilin
eksaoktavian berati kamu mental tempe,eksaoktavian berati kamu mental tempe,eksaoktavian berati kamu mental tempe,"['eksaoktavian', 'berati', 'kamu', 'mental', 'tempe']","['eksaoktavian', 'berati', 'mental', 'tempe']","['eksaoktavian', 'berati', 'mental', 'tempe']",eksaoktavian berati mental tempe
eri one11 makany sekarang  pemain bola muda tidak keras mental tempe,eri one makany sekarang pemain bola muda tidak keras mental tempe,eri one makany sekarang pemain bola muda tidak keras mental tempe,"['eri', 'one', 'makany', 'sekarang', 'pemain', 'bola', 'muda', 'tidak', 'keras', 'mental', 'tempe']","['eri', 'one', 'makany', 'pemain', 'bola', 'muda', 'keras', 'mental', 'tempe']","['eri', 'one', 'makany', 'pemain', 'bola', 'muda', 'keras', 'mental', 'tempe']",eri one makany pemain bola muda keras mental tempe
f4izalhassan bombajbpm tak boleh  fikir betapa cracknya mental anak2 mati trauma seumur hidup dengan  water heater takziah untuk  keluarga, izalhassan bombajbpm tak boleh fikir betapa cracknya mental anak mati trauma seumur hidup dengan water heater takziah untuk keluarga, izalhassan bombajbpm tak boleh fikir betapa cracknya mental anak mati trauma seumur hidup dengan water heater takziah untuk keluarga,"['', 'izalhassan', 'bombajbpm', 'tak', 'boleh', 'fikir', 'betapa', 'cracknya', 'mental', 'anak', 'mati', 'trauma', 'seumur', 'hidup', 'dengan', 'water', 'heater', 'takziah', 'untuk', 'keluarga']","['', 'izalhassan', 'bombajbpm', 'fikir', 'betapa', 'cracknya', 'mental', 'anak', 'mati', 'trauma', 'seumur', 'hidup', 'water', 'heater', 'takziah', 'keluarga']","['', 'izalhassan', 'bombajbpm', 'fikir', 'betapa', 'cracknya', 'mental', 'anak', 'mati', 'trauma', 'seumur', 'hidup', 'water', 'heater', 'takziah', 'keluarga']",izalhassan bombajbpm fikir betapa cracknya mental anak mati trauma seumur hidup water heater takziah keluarga
faizaufi coba bantalnya dilempar anak kalau  mental berarti benar  punya ilmu,faizaufi coba bantalnya dilempar anak kalau mental berarti benar punya ilmu,faizaufi coba bantalnya dilempar anak kalau mental berarti benar punya ilmu,"['faizaufi', 'coba', 'bantalnya', 'dilempar', 'anak', 'kalau', 'mental', 'berarti', 'benar', 'punya', 'ilmu']","['faizaufi', 'coba', 'bantalnya', 'dilempar', 'anak', 'mental', 'ilmu']","['faizaufi', 'coba', 'bantalnya', 'dilempar', 'anak', 'mental', 'ilmu']",faizaufi coba bantalnya dilempar anak mental ilmu
faizaufi coba dilempar bantal kalau  mental baru percaya xf0 x9f xa4 xa3,faizaufi coba dilempar bantal kalau mental baru percaya ,faizaufi coba dilempar bantal kalau mental baru percaya ,"['faizaufi', 'coba', 'dilempar', 'bantal', 'kalau', 'mental', 'baru', 'percaya', '']","['faizaufi', 'coba', 'dilempar', 'bantal', 'mental', 'percaya', '']","['faizaufi', 'coba', 'dilempar', 'bantal', 'mental', 'percaya', '']",faizaufi coba dilempar bantal mental percaya
finnanoviyanti makanya ngeri bangettt kudu siap mental menghadapi fase tumgi pasti datang  xf0 x9f xa4 xa3,finnanoviyanti makanya ngeri bangettt kudu siap mental menghadapi fase tumgi pasti datang ,finnanoviyanti makanya ngeri bangettt kudu siap mental menghadapi fase tumgi pasti datang ,"['finnanoviyanti', 'makanya', 'ngeri', 'bangettt', 'kudu', 'siap', 'mental', 'menghadapi', 'fase', 'tumgi', 'pasti', 'datang', '']","['finnanoviyanti', 'ngeri', 'bangettt', 'kudu', 'mental', 'menghadapi', 'fase', 'tumgi', '']","['finnanoviyanti', 'ngeri', 'bangettt', 'kudu', 'mental', 'menghadapi', 'fase', 'tumgi', '']",finnanoviyanti ngeri bangettt kudu mental menghadapi fase tumgi
flikrii bukanmayoritas the redsindo betul memang  bagus sih dari  awal lawannya berat berat jadi kalau  lolos siap mental,flikrii bukanmayoritas the redsindo betul memang bagus sih dari awal lawannya berat berat jadi kalau lolos siap mental,flikrii bukanmayoritas the redsindo betul memang bagus sih dari awal lawannya berat berat jadi kalau lolos siap mental,"['flikrii', 'bukanmayoritas', 'the', 'redsindo', 'betul', 'memang', 'bagus', 'sih', 'dari', 'awal', 'lawannya', 'berat', 'berat', 'jadi', 'kalau', 'lolos', 'siap', 'mental']","['flikrii', 'bukanmayoritas', 'the', 'redsindo', 'bagus', 'sih', 'lawannya', 'berat', 'berat', 'lolos', 'mental']","['flikrii', 'bukanmayoritas', 'the', 'redsindo', 'bagus', 'sih', 'lawannya', 'berat', 'berat', 'lolos', 'mental']",flikrii bukanmayoritas the redsindo bagus sih lawannya berat berat lolos mental
gagalbackstreet benar  bangeet capeknya tuh fisik mental teriakannya terngiang xe2 x80 x9d hahahaha,gagalbackstreet benar bangeet capeknya tuh fisik mental teriakannya terngiang hahahaha,gagalbackstreet benar bangeet capeknya tuh fisik mental teriakannya terngiang hahahaha,"['gagalbackstreet', 'benar', 'bangeet', 'capeknya', 'tuh', 'fisik', 'mental', 'teriakannya', 'terngiang', 'hahahaha']","['gagalbackstreet', 'bangeet', 'capeknya', 'tuh', 'fisik', 'mental', 'teriakannya', 'terngiang', 'hahahaha']","['gagalbackstreet', 'bangeet', 'capeknya', 'tuh', 'fisik', 'mental', 'teriakannya', 'terngiang', 'hahahaha']",gagalbackstreet bangeet capeknya tuh fisik mental teriakannya terngiang hahahaha
gasukaluwkwk jiiiyah ngeri terus  kena mental cil,gasukaluwkwk jiiiyah ngeri terus kena mental cil,gasukaluwkwk jiiiyah ngeri terus kena mental cil,"['gasukaluwkwk', 'jiiiyah', 'ngeri', 'terus', 'kena', 'mental', 'cil']","['gasukaluwkwk', 'jiiiyah', 'ngeri', 'kena', 'mental', 'cil']","['gasukaluwkwk', 'jiiiyah', 'ngeri', 'kena', 'mental', 'cil']",gasukaluwkwk jiiiyah ngeri kena mental cil
coachjustinl gol benz pertama bikin mental pasang  down sih kayaknya tidak  aggregat masih lolos gol xe2 x80 xa6 bcblurhwuk,coachjustinl gol benz pertama bikin mental pasang down sih kayaknya tidak aggregat masih lolos gol bcblurhwuk,coachjustinl gol benz pertama bikin mental pasang down sih kayaknya tidak aggregat masih lolos gol bcblurhwuk,"['coachjustinl', 'gol', 'benz', 'pertama', 'bikin', 'mental', 'pasang', 'down', 'sih', 'kayaknya', 'tidak', 'aggregat', 'masih', 'lolos', 'gol', 'bcblurhwuk']","['coachjustinl', 'gol', 'benz', 'bikin', 'mental', 'pasang', 'down', 'sih', 'kayaknya', 'aggregat', 'lolos', 'gol', 'bcblurhwuk']","['coachjustinl', 'gol', 'benz', 'bikin', 'mental', 'pasang', 'down', 'sih', 'kayaknya', 'aggregat', 'lolos', 'gol', 'bcblurhwuk']",coachjustinl gol benz bikin mental pasang down sih kayaknya aggregat lolos gol bcblurhwuk
agwss1 nyaiibubu kondisi mental capai  sama pandemi tekanan ekonomi provokasi ajakan bergembira berlandaskan acara agama selesai  sudah  perhatikan makin banyak abai belakangan,agwss nyaiibubu kondisi mental capai sama pandemi tekanan ekonomi provokasi ajakan bergembira berlandaskan acara agama selesai sudah perhatikan makin banyak abai belakangan,agwss nyaiibubu kondisi mental capai sama pandemi tekanan ekonomi provokasi ajakan bergembira berlandaskan acara agama selesai sudah perhatikan makin banyak abai belakangan,"['agwss', 'nyaiibubu', 'kondisi', 'mental', 'capai', 'sama', 'pandemi', 'tekanan', 'ekonomi', 'provokasi', 'ajakan', 'bergembira', 'berlandaskan', 'acara', 'agama', 'selesai', 'sudah', 'perhatikan', 'makin', 'banyak', 'abai', 'belakangan']","['agwss', 'nyaiibubu', 'kondisi', 'mental', 'capai', 'pandemi', 'tekanan', 'ekonomi', 'provokasi', 'ajakan', 'bergembira', 'berlandaskan', 'acara', 'agama', 'selesai', 'perhatikan', 'abai']","['agwss', 'nyaiibubu', 'kondisi', 'mental', 'capai', 'pandemi', 'tekanan', 'ekonomi', 'provokasi', 'ajakan', 'bergembira', 'berlandaskan', 'acara', 'agama', 'selesai', 'perhatikan', 'abai']",agwss nyaiibubu kondisi mental capai pandemi tekanan ekonomi provokasi ajakan bergembira berlandaskan acara agama selesai perhatikan abai
collegemenfess tidak apa-apa sender memang ppkm pandemi bikin  capai  saya capai  mental capai  pikiran tidak bisa mengembangkan diri dengan  maksimal tidak bisa explore lain saya  merasa  katak dalam  tempurung asli teman  kampus dkt2 sangat  suka muncul ketakutan saya  tidak punya teman ,collegemenfess tidak apa apa sender memang ppkm pandemi bikin capai saya capai mental capai pikiran tidak bisa mengembangkan diri dengan maksimal tidak bisa explore lain saya merasa katak dalam tempurung asli teman kampus dkt sangat suka muncul ketakutan saya tidak punya teman ,collegemenfess tidak apa apa sender memang ppkm pandemi bikin capai saya capai mental capai pikiran tidak bisa mengembangkan diri dengan maksimal tidak bisa explore lain saya merasa katak dalam tempurung asli teman kampus dkt sangat suka muncul ketakutan saya tidak punya teman ,"['collegemenfess', 'tidak', 'apa', 'apa', 'sender', 'memang', 'ppkm', 'pandemi', 'bikin', 'capai', 'saya', 'capai', 'mental', 'capai', 'pikiran', 'tidak', 'bisa', 'mengembangkan', 'diri', 'dengan', 'maksimal', 'tidak', 'bisa', 'explore', 'lain', 'saya', 'merasa', 'katak', 'dalam', 'tempurung', 'asli', 'teman', 'kampus', 'dkt', 'sangat', 'suka', 'muncul', 'ketakutan', 'saya', 'tidak', 'punya', 'teman', '']","['collegemenfess', 'sender', 'ppkm', 'pandemi', 'bikin', 'capai', 'capai', 'mental', 'capai', 'pikiran', 'mengembangkan', 'maksimal', 'explore', 'katak', 'tempurung', 'asli', 'teman', 'kampus', 'dkt', 'suka', 'muncul', 'ketakutan', 'teman', '']","['collegemenfess', 'sender', 'ppkm', 'pandemi', 'bikin', 'capai', 'capai', 'mental', 'capai', 'pikiran', 'mengembangkan', 'maksimal', 'explore', 'katak', 'tempurung', 'asli', 'teman', 'kampus', 'dekat ', 'suka', 'muncul', 'ketakutan', 'teman', '']",collegemenfess sender ppkm pandemi bikin capai capai mental capai pikiran mengembangkan maksimal explore katak tempurung asli teman kampus dekat  suka muncul ketakutan teman
menerapkan cara menjaga kesehatan mental baik pandemi covid kamu lebih siap menjalani hari bisa melakukan produktif lainnya salah satu kunci tubuh sehat hati gembira staysafestayhealthy lawancovid19,menerapkan cara menjaga kesehatan mental baik pandemi covid kamu lebih siap menjalani hari bisa melakukan produktif lainnya salah satu kunci tubuh sehat hati gembira staysafestayhealthy lawancovid ,menerapkan cara menjaga kesehatan mental baik pandemi covid kamu lebih siap menjalani hari bisa melakukan produktif lainnya salah satu kunci tubuh sehat hati gembira staysafestayhealthy lawancovid ,"['menerapkan', 'cara', 'menjaga', 'kesehatan', 'mental', 'baik', 'pandemi', 'covid', 'kamu', 'lebih', 'siap', 'menjalani', 'hari', 'bisa', 'melakukan', 'produktif', 'lainnya', 'salah', 'satu', 'kunci', 'tubuh', 'sehat', 'hati', 'gembira', 'staysafestayhealthy', 'lawancovid', '']","['menerapkan', 'menjaga', 'kesehatan', 'mental', 'pandemi', 'covid', 'menjalani', 'produktif', 'salah', 'kunci', 'tubuh', 'sehat', 'hati', 'gembira', 'staysafestayhealthy', 'lawancovid', '']","['menerapkan', 'menjaga', 'kesehatan', 'mental', 'pandemi', 'covid', 'menjalani', 'produktif', 'salah', 'kunci', 'tubuh', 'sehat', 'hati', 'gembira', 'staysafestayhealthy', 'lawancovid', '']",menerapkan menjaga kesehatan mental pandemi covid menjalani produktif salah kunci tubuh sehat hati gembira staysafestayhealthy lawancovid
nangis thanks kak karena  tweet kakak saya reflecting diriku selama selalu insecure karena  merasa  tidak bisa tidak ada kelebihan apa2 ternyata kelebihanku banyak walaupun sederhana masih sehat walafiat kondisi pandemi walaupun mental suka terguncang,nangis thanks kak karena tweet kakak saya reflecting diriku selama selalu insecure karena merasa tidak bisa tidak ada kelebihan apa ternyata kelebihanku banyak walaupun sederhana masih sehat walafiat kondisi pandemi walaupun mental suka terguncang,nangis thanks kak karena tweet kakak saya reflecting diriku selama selalu insecure karena merasa tidak bisa tidak ada kelebihan apa ternyata kelebihanku banyak walaupun sederhana masih sehat walafiat kondisi pandemi walaupun mental suka terguncang,"['nangis', 'thanks', 'kak', 'karena', 'tweet', 'kakak', 'saya', 'reflecting', 'diriku', 'selama', 'selalu', 'insecure', 'karena', 'merasa', 'tidak', 'bisa', 'tidak', 'ada', 'kelebihan', 'apa', 'ternyata', 'kelebihanku', 'banyak', 'walaupun', 'sederhana', 'masih', 'sehat', 'walafiat', 'kondisi', 'pandemi', 'walaupun', 'mental', 'suka', 'terguncang']","['nangis', 'thanks', 'kak', 'tweet', 'kakak', 'reflecting', 'diriku', 'insecure', 'ada', 'kelebihan', 'kelebihanku', 'sederhana', 'sehat', 'walafiat', 'kondisi', 'pandemi', 'mental', 'suka', 'terguncang']","['nangis', 'thanks', 'kak', 'tweet', 'kakak', 'reflecting', 'diriku', 'insecure', 'ada', 'kelebihan', 'kelebihanku', 'sederhana', 'sehat', 'walafiat', 'kondisi', 'pandemi', 'mental', 'suka', 'terguncang']",nangis thanks kak tweet kakak reflecting diriku insecure ada kelebihan kelebihanku sederhana sehat walafiat kondisi pandemi mental suka terguncang
selama pandemi dirumah saja  tidak  pergi sekolah ternyata really good for mental kesehatan hanya enaknya begitu  masalah mah ada saja ,selama pandemi dirumah saja tidak pergi sekolah ternyata really good for mental kesehatan hanya enaknya begitu masalah mah ada saja ,selama pandemi dirumah saja tidak pergi sekolah ternyata really good for mental kesehatan hanya enaknya begitu masalah mah ada saja ,"['selama', 'pandemi', 'dirumah', 'saja', 'tidak', 'pergi', 'sekolah', 'ternyata', 'really', 'good', 'for', 'mental', 'kesehatan', 'hanya', 'enaknya', 'begitu', 'masalah', 'mah', 'ada', 'saja', '']","['pandemi', 'dirumah', 'pergi', 'sekolah', 'really', 'good', 'for', 'mental', 'kesehatan', 'enaknya', 'mah', 'ada', '']","['pandemi', 'dirumah', 'pergi', 'sekolah', 'really', 'good', 'for', 'mental', 'kesehatan', 'enaknya', 'mah', 'ada', '']",pandemi dirumah pergi sekolah really good for mental kesehatan enaknya mah ada
siapa berpotensi mengalami masalah mental pandemi covid apa perlu dilakukan menjaga kesehatan mental pandemi simak radio talk bersama lawancovid19 bnpb indonesia ingatpesanibu sudahdivaksintetap3m vaksinmelindungikitasemua ldz6cdc9z9,siapa berpotensi mengalami masalah mental pandemi covid apa perlu dilakukan menjaga kesehatan mental pandemi simak radio talk bersama lawancovid bnpb indonesia ingatpesanibu sudahdivaksintetap vaksinmelindungikitasemua ldz cdc ,siapa berpotensi mengalami masalah mental pandemi covid apa perlu dilakukan menjaga kesehatan mental pandemi simak radio talk bersama lawancovid bnpb indonesia ingatpesanibu sudahdivaksintetap vaksinmelindungikitasemua ldz cdc ,"['siapa', 'berpotensi', 'mengalami', 'masalah', 'mental', 'pandemi', 'covid', 'apa', 'perlu', 'dilakukan', 'menjaga', 'kesehatan', 'mental', 'pandemi', 'simak', 'radio', 'talk', 'bersama', 'lawancovid', 'bnpb', 'indonesia', 'ingatpesanibu', 'sudahdivaksintetap', 'vaksinmelindungikitasemua', 'ldz', 'cdc', '']","['berpotensi', 'mengalami', 'mental', 'pandemi', 'covid', 'menjaga', 'kesehatan', 'mental', 'pandemi', 'simak', 'radio', 'talk', 'lawancovid', 'bnpb', 'indonesia', 'ingatpesanibu', 'sudahdivaksintetap', 'vaksinmelindungikitasemua', 'ldz', 'cdc', '']","['berpotensi', 'mengalami', 'mental', 'pandemi', 'covid', 'menjaga', 'kesehatan', 'mental', 'pandemi', 'simak', 'radio', 'talk', 'lawancovid', 'bnpb', 'indonesia', 'ingatpesanibu', 'sudahdivaksintetap', 'vaksinmelindungikitasemua', 'ldz', 'cdc', '']",berpotensi mengalami mental pandemi covid menjaga kesehatan mental pandemi simak radio talk lawancovid bnpb indonesia ingatpesanibu sudahdivaksintetap vaksinmelindungikitasemua ldz cdc
simak tips sederhana menjaga kesehatan mental pandemi merahputihcom tips selfcare selflove rnshennkn5,simak tips sederhana menjaga kesehatan mental pandemi merahputihcom tips selfcare selflove rnshennkn ,simak tips sederhana menjaga kesehatan mental pandemi merahputihcom tips selfcare selflove rnshennkn ,"['simak', 'tips', 'sederhana', 'menjaga', 'kesehatan', 'mental', 'pandemi', 'merahputihcom', 'tips', 'selfcare', 'selflove', 'rnshennkn', '']","['simak', 'tips', 'sederhana', 'menjaga', 'kesehatan', 'mental', 'pandemi', 'merahputihcom', 'tips', 'selfcare', 'selflove', 'rnshennkn', '']","['simak', 'tips', 'sederhana', 'menjaga', 'kesehatan', 'mental', 'pandemi', 'merahputihcom', 'tips', 'selfcare', 'selflove', 'rnshennkn', '']",simak tips sederhana menjaga kesehatan mental pandemi merahputihcom tips selfcare selflove rnshennkn
yuk bantu penuhi nutrisigardaterdepan tim medis ini berjuang garda terdepan menangani kasus covid tidak sedikit mengalami kelelahan fisik mental tingginya beban kerja akibat covid berdampak pada menurunnya imunitas,yuk bantu penuhi nutrisigardaterdepan tim medis ini berjuang garda terdepan menangani kasus covid tidak sedikit mengalami kelelahan fisik mental tingginya beban kerja akibat covid berdampak pada menurunnya imunitas,yuk bantu penuhi nutrisigardaterdepan tim medis ini berjuang garda terdepan menangani kasus covid tidak sedikit mengalami kelelahan fisik mental tingginya beban kerja akibat covid berdampak pada menurunnya imunitas,"['yuk', 'bantu', 'penuhi', 'nutrisigardaterdepan', 'tim', 'medis', 'ini', 'berjuang', 'garda', 'terdepan', 'menangani', 'kasus', 'covid', 'tidak', 'sedikit', 'mengalami', 'kelelahan', 'fisik', 'mental', 'tingginya', 'beban', 'kerja', 'akibat', 'covid', 'berdampak', 'pada', 'menurunnya', 'imunitas']","['yuk', 'bantu', 'penuhi', 'nutrisigardaterdepan', 'tim', 'medis', 'berjuang', 'garda', 'terdepan', 'menangani', 'covid', 'mengalami', 'kelelahan', 'fisik', 'mental', 'tingginya', 'beban', 'kerja', 'akibat', 'covid', 'berdampak', 'menurunnya', 'imunitas']","['yuk', 'bantu', 'penuhi', 'nutrisigardaterdepan', 'tim', 'medis', 'berjuang', 'garda', 'terdepan', 'menangani', 'covid', 'mengalami', 'kelelahan', 'fisik', 'mental', 'tingginya', 'beban', 'kerja', 'akibat', 'covid', 'berdampak', 'menurunnya', 'imunitas']",yuk bantu penuhi nutrisigardaterdepan tim medis berjuang garda terdepan menangani covid mengalami kelelahan fisik mental tingginya beban kerja akibat covid berdampak menurunnya imunitas
ahh besok sudah  mulung streaming nya tiring day ngantuk sangat  lelah fisik mental wkwkwkw trying xe2 x80 xa6 9jc6r8jik8,ahh besok sudah mulung streaming nya tiring day ngantuk sangat lelah fisik mental wkwkwkw trying jik ,ahh besok sudah mulung streaming nya tiring day ngantuk sangat lelah fisik mental wkwkwkw trying jik ,"['ahh', 'besok', 'sudah', 'mulung', 'streaming', 'nya', 'tiring', 'day', 'ngantuk', 'sangat', 'lelah', 'fisik', 'mental', 'wkwkwkw', 'trying', 'jik', '']","['ahh', 'besok', 'mulung', 'streaming', 'nya', 'tiring', 'day', 'ngantuk', 'lelah', 'fisik', 'mental', 'wkwkwkw', 'trying', 'jik', '']","['ahh', 'besok', 'mulung', 'streaming', 'nya', 'tiring', 'day', 'ngantuk', 'lelah', 'fisik', 'mental', 'wkwkwkw', 'trying', 'jik', '']",ahh besok mulung streaming nya tiring day ngantuk lelah fisik mental wkwkwkw trying jik
